{
  "schema": "welesza.asset.v1",
  "id": "ENM-zdziczaly-pies",
  "kind": "character",
  "canvas": [
    512,
    512
  ],
  "anchor": [
    256,
    448
  ],
  "status": "test",
  "source": "GPT-6",
  "background": "transparent",
  "directions": [
    "s",
    "sw",
    "w",
    "nw",
    "n"
  ],
  "mirror": {
    "se": "sw",
    "e": "w",
    "ne": "nw"
  },
  "layers": [
    "full"
  ],
  "animations": {
    "walk": {
      "frames": 1,
      "fps": 12,
      "loop": false
    }
  },
  "collision": {
    "circle": 40
  }
}
