{
  "schema": "welesza.asset.v1",
  "id": "PROP-kamien",
  "status": "test",
  "source": "GPT-6",
  "background": "transparent",
  "kind": "prop",
  "canvas": [
    512,
    512
  ],
  "anchor": [
    256,
    400
  ],
  "layers": [
    "full"
  ],
  "collision": {
    "circle": 90
  },
  "occlusion_y": 400
}
