{
  "schema": "welesza.asset.v1",
  "id": "ENM-drwal",
  "kind": "character",
  "canvas": [
    512,
    512
  ],
  "anchor": [
    256,
    448
  ],
  "status": "test",
  "source": "GPT-6",
  "background": "transparent",
  "directions": [
    "s",
    "sw",
    "w",
    "nw",
    "n"
  ],
  "layers": [
    "full"
  ],
  "animations": {
    "idle": {
      "frames": 4,
      "fps": 12,
      "loop": true
    },
    "walk": {
      "frames": 8,
      "fps": 12,
      "loop": true,
      "events": [
        {
          "frame": 0,
          "name": "step"
        },
        {
          "frame": 4,
          "name": "step"
        }
      ]
    },
    "slash": {
      "frames": 7,
      "fps": 12,
      "loop": false,
      "events": [
        {
          "frame": 0,
          "name": "telegraph_start"
        },
        {
          "frame": 3,
          "name": "hit_start"
        },
        {
          "frame": 4,
          "name": "hit_end"
        }
      ]
    },
    "cleave": {
      "frames": 9,
      "fps": 12,
      "loop": false,
      "events": [
        {
          "frame": 1,
          "name": "telegraph_start"
        },
        {
          "frame": 5,
          "name": "hit_start"
        },
        {
          "frame": 6,
          "name": "hit_end"
        }
      ]
    },
    "spin": {
      "frames": 9,
      "fps": 12,
      "loop": false,
      "events": [
        {
          "frame": 0,
          "name": "telegraph_start"
        },
        {
          "frame": 2,
          "name": "hit_start"
        },
        {
          "frame": 6,
          "name": "hit_end"
        }
      ]
    },
    "hit": {
      "frames": 3,
      "fps": 12,
      "loop": false
    }
  },
  "collision": {
    "circle": 36
  },
  "mirror": {
    "se": "sw",
    "e": "w",
    "ne": "nw"
  }
}
