{
  "schema": "welesza.asset.v1",
  "id": "HERO-bohater",
  "kind": "character",
  "canvas": [
    512,
    512
  ],
  "anchor": [
    256,
    448
  ],
  "status": "test",
  "source": "GPT-6",
  "background": "transparent",
  "directions": [
    "s",
    "sw",
    "w",
    "nw",
    "n",
    "ne",
    "e",
    "se"
  ],
  "layers": [
    "full"
  ],
  "animations": {
    "idle": {
      "frames": 1,
      "fps": 12,
      "loop": false
    },
    "walk": {
      "frames": 8,
      "fps": 12,
      "loop": true,
      "events": [
        {
          "frame": 0,
          "name": "step"
        },
        {
          "frame": 4,
          "name": "step"
        }
      ]
    },
    "attack": {
      "frames": 7,
      "fps": 12,
      "loop": false,
      "events": [
        {
          "frame": 0,
          "name": "telegraph_start"
        },
        {
          "frame": 3,
          "name": "hit_start"
        },
        {
          "frame": 4,
          "name": "hit_end"
        },
        {
          "frame": 5,
          "name": "combo_open"
        },
        {
          "frame": 6,
          "name": "combo_close"
        }
      ]
    }
  },
  "collision": {
    "circle": 36
  }
}
